{"file":{"bytes":782,"relativePath":"accounting.json","sha256":"10dac9b5d06b1e1416f314bea3c8282084db7caaebe6115f3f0834bba649b28c"},"manifestSha256":"410604b74cd55528842050c2a2246eb1e1187c4563575441a65e66e2472d5cc6","namespaceId":"0123456789abcdef0123456789abcdef","runId":"2026-10-18-example-run-store-query-22222222222222222222222222222222","schema":"intelli-v1/accounting-committed","schemaVersion":1}
